"Sandcastle mansion boating family-friendly, Condo, 4, 11, 3, 2410, Spectacular views., 4.2, 200, Ryder Gaylord, 102, Mississippi, New Shania, http://lorempixel.com/640/480/nature"
"Relaxing manor hiking-friendly ski resort, Apartment, 2, 7, 2, 4380, Good ammenities., 4.6, 125, Joy Koelpin, 50, Illinois, Lake Dameonmouth, http://lorempixel.com/640/480/transport"
"Luxury townhouse close walk to beach bicycles, Apartment, 4, 11, 1, 2990, Excellent., 4.6, 167, Alisha Hermiston, 66, Minnesota, Kaneport, http://lorempixel.com/640/480/cats"
"Paradise home surf gated community, House, 1, 3, 3, 6440, Good ammenities., 4.2, 209, Maxwell Renner, 100, Alaska, Krisfort, http://lorempixel.com/640/480/business"
"River front beachhouse yacht surf, Condo, 4, 11, 2, 6130, Very good., 4.4, 127, Ignatius Morissette, 56, Nebraska, Strosinbury, http://lorempixel.com/640/480/fashion"
"Hidden lodge pool pool, House, 2, 5, 1, 4630, Good ammenities., 4.9, 64, Marshall Morissette, 92, Mississippi, North Kaleside, http://lorempixel.com/640/480/nature"
"Great escape lodging bicycles ac/heating, House, 2, 5, 1, 2230, Good for families., 4.9, 75, Lynn Bergstrom, 28, Tennessee, Antoinettechester, http://lorempixel.com/640/480/nature"
"Quaint & cozy cottage pool jacuzzi, Condo, 2, 5, 2, 5390, Very good., 4.5, 153, Angus Harber, 98, Utah, Grantside, http://lorempixel.com/640/480/transport"
"Quiet summer home yacht great amenities, Apartment, 3, 8, 3, 3810, Beautiful view., 4, 29, Rebeca Maggio, 16, Nevada, Lillymouth, http://lorempixel.com/640/480/sports"
"Secluded home ski resort backyard wilderness, Townhouse, 1, 4, 3, 1650, Good ammenities., 4.5, 165, Xzavier McCullough, 36, Rhode Island, West Shemarhaven, http://lorempixel.com/640/480/abstract"
"Beach bungalow ranch fooseball gourmet kitchen, Condo, 1, 3, 3, 6740, Great bargain., 4.3, 124, Rosalyn Hermiston DDS, 19, New Hampshire, New Luellachester, http://lorempixel.com/640/480/nature"
"Stylish beachhouse boating amazing garden, House, 1, 4, 1, 1390, Beautiful view., 4.4, 187, Demarco Bayer, 109, Oregon, Alfonsoshire, http://lorempixel.com/640/480/city"
"Paradise log home surf spa, Apartment, 5, 13, 2, 4710, Great., 4.1, 164, Mr. Angel Jacobs, 89, Oklahoma, Hayleystad, http://lorempixel.com/640/480/sports"
"Pine cone estate pool pool, House, 1, 5, 1, 5480, Convenient location., 4.6, 27, Mrs. Newton Heidenreich, 68, Mississippi, Rosechester, http://lorempixel.com/640/480/sports"
"Cliffside home ac/heating close to downtown, Townhouse, 1, 5, 2, 5920, Great find., 4.1, 208, Maegan Lindgren, 73, New Mexico, Lake Chelsey, http://lorempixel.com/640/480/transport"
"Spring views chalet hot tub close walk to beach, Townhouse, 5, 13, 2, 6780, Great find., 4.7, 111, Gayle O'Hara, 83, Alabama, New Nedra, http://lorempixel.com/640/480/technics"
"Tuscan apartment jacuzzi fishing, Townhouse, 5, 13, 3, 2110, Convenient location., 4.1, 149, Minnie Leannon, 30, Massachusetts, Olsonfurt, http://lorempixel.com/640/480/sports"
"Paradise winter lodge surf gourmet kitchen, Townhouse, 5, 11, 3, 1530, Good ammenities., 4.9, 127, Mariela Ondricka, 39, North Dakota, Watsicaberg, http://lorempixel.com/640/480/business"
"Grand summer home fishing hiking-friendly, House, 3, 8, 2, 3970, Spectacular views., 4.4, 189, Russel Kozey, 50, Mississippi, North Karolann, http://lorempixel.com/640/480/technics"
"Spacious mansion game room pet-friendly, House, 4, 10, 3, 4180, Exceptional., 4.2, 77, Ms. Karson Effertz, 82, Montana, Ocieberg, http://lorempixel.com/640/480/city"
